{"$schema":"https://json-schema.org/draft/2020-12/schema","title":"ZPP workflow contract","type":"object","additionalProperties":false,"required":["version","name","mode","stages"],"properties":{"version":{"const":1},"name":{"type":"string","minLength":1},"mode":{"const":"reminder"},"stages":{"type":"array","minItems":1,"items":{"type":"object","additionalProperties":false,"required":["id","component"],"properties":{"id":{"type":"string","minLength":1},"component":{"type":"string","pattern":"^zpps-[a-z0-9-]+$"}}}}}}
