{"version":1,"name":"zpp-scaffold","mode":"reminder","stages":[{"id":"clarify","component":"zpps-clarify"},{"id":"shape-bdd","component":"zpps-shape-bdd"},{"id":"plan-utilities","component":"zpps-planning-ponytail"},{"id":"mature-utilities","component":"zpps-mature-utilities"},{"id":"wire","component":"zpps-wire"},{"id":"form-specs","component":"zpps-form-specs"},{"id":"finalize","component":"zpps-finalize"}]}
